{
  "ambiguity_groups": [],
  "annotator_id": null,
  "coordinate_space": {
    "display_transforms": [],
    "height_px": 3738,
    "origin": "top_left",
    "units": "source_pixels",
    "width_px": 4972,
    "x_axis": "right",
    "y_axis": "down"
  },
  "external_transliterations_used": false,
  "glyph_candidates": [],
  "lines": [],
  "package_id": "OBS-PKG-YDC-PANEL-1006194-R000",
  "package_status": "blank",
  "protocol_id": "OBSERVATION-PROTOCOL-0001",
  "reading_order_asserted": false,
  "regions": [],
  "revision": {
    "created_at": null,
    "revision_number": 0,
    "supersedes_package_id": null
  },
  "revision_events": [],
  "schema_version": "0.1.0",
  "semantic_interpretation_used": false,
  "source": {
    "height_px": 3738,
    "institutional_id": "1006194",
    "institutional_label": "67r",
    "photographic_panel_id": "YDC-PANEL-1006194",
    "source_sha256": "f8b4e5c4a73b92af3d9a6e6bd5cdc7e43b3e9c5d721171aa969384198e1579e3",
    "source_url": "https://collections.library.yale.edu/iiif/2/1006194/full/full/0/default.jpg",
    "stored_path": "sha256/f8/f8b4e5c4a73b92af3d9a6e6bd5cdc7e43b3e9c5d721171aa969384198e1579e3.jpg",
    "width_px": 4972
  }
}
