{
  "ambiguity_groups": [],
  "annotator_id": null,
  "coordinate_space": {
    "display_transforms": [],
    "height_px": 3777,
    "origin": "top_left",
    "units": "source_pixels",
    "width_px": 9078,
    "x_axis": "right",
    "y_axis": "down"
  },
  "external_transliterations_used": false,
  "glyph_candidates": [],
  "lines": [],
  "package_id": "OBS-PKG-YDC-PANEL-1006233-R000",
  "package_status": "blank",
  "protocol_id": "OBSERVATION-PROTOCOL-0001",
  "reading_order_asserted": false,
  "regions": [],
  "revision": {
    "created_at": null,
    "revision_number": 0,
    "supersedes_package_id": null
  },
  "revision_events": [],
  "schema_version": "0.1.0",
  "semantic_interpretation_used": false,
  "source": {
    "height_px": 3777,
    "institutional_id": "1006233",
    "institutional_label": "88v and 89r",
    "photographic_panel_id": "YDC-PANEL-1006233",
    "source_sha256": "7049c6388594445419386c9e8ee3516e41d2a5d8677734c43038318e2954ade6",
    "source_url": "https://collections.library.yale.edu/iiif/2/1006233/full/full/0/default.jpg",
    "stored_path": "sha256/70/7049c6388594445419386c9e8ee3516e41d2a5d8677734c43038318e2954ade6.jpg",
    "width_px": 9078
  }
}
