{
  "ambiguity_groups": [],
  "annotator_id": null,
  "coordinate_space": {
    "display_transforms": [],
    "height_px": 3697,
    "origin": "top_left",
    "units": "source_pixels",
    "width_px": 2671,
    "x_axis": "right",
    "y_axis": "down"
  },
  "external_transliterations_used": false,
  "glyph_candidates": [],
  "lines": [],
  "package_id": "OBS-PKG-YDC-PANEL-1006273-R000",
  "package_status": "blank",
  "protocol_id": "OBSERVATION-PROTOCOL-0001",
  "reading_order_asserted": false,
  "regions": [],
  "revision": {
    "created_at": null,
    "revision_number": 0,
    "supersedes_package_id": null
  },
  "revision_events": [],
  "schema_version": "0.1.0",
  "semantic_interpretation_used": false,
  "source": {
    "height_px": 3697,
    "institutional_id": "1006273",
    "institutional_label": "114v",
    "photographic_panel_id": "YDC-PANEL-1006273",
    "source_sha256": "d6566160c2326f35770d0d3b3291fc4f30f6049969adf64f98387f6b453d518d",
    "source_url": "https://collections.library.yale.edu/iiif/2/1006273/full/full/0/default.jpg",
    "stored_path": "sha256/d6/d6566160c2326f35770d0d3b3291fc4f30f6049969adf64f98387f6b453d518d.jpg",
    "width_px": 2671
  }
}
