{"ambiguity_groups":[],"annotator_id":null,"coordinate_space":{"display_transforms":[],"height_px":3750,"origin":"top_left","units":"source_pixels","width_px":2731,"x_axis":"right","y_axis":"down"},"external_transliterations_used":false,"glyph_candidates":[],"lines":[],"package_id":"OBS-PKG-YDC-PANEL-1006242-R000","package_status":"blank","protocol_id":"OBSERVATION-PROTOCOL-0001","reading_order_asserted":false,"regions":[],"revision":{"created_at":null,"revision_number":0,"supersedes_package_id":null},"revision_events":[],"schema_version":"0.1.0","semantic_interpretation_used":false,"source":{"height_px":3750,"institutional_id":"1006242","institutional_label":"95v (part)","photographic_panel_id":"YDC-PANEL-1006242","source_sha256":"7f6c70a788da007c7b4be55195c25b893f60afae1b111a07f75f97b218ca32d7","source_url":"https://collections.library.yale.edu/iiif/2/1006242/full/full/0/default.jpg","stored_path":"sha256/7f/7f6c70a788da007c7b4be55195c25b893f60afae1b111a07f75f97b218ca32d7.jpg","width_px":2731}}
